[
  {
    "name": "Tel Baruch Beach",
    "category": "beach",
    "latitude": 32.1212765,
    "longitude": 34.7819896,
    "formatted_address": "Tel Baruch Beach, HaTayelet, Tel Aviv-Yafo, Israel",
    "neighborhood": "Tel Baruch",
    "short_description": "Municipal lifeguarded beach in Tel Aviv-Yafo. Check seasonal lifeguard hours before visiting.",
    "is_indoor": false,
    "is_outdoor": true,
    "is_free": true,
    "price_note": null,
    "min_age_months": 0,
    "max_age_months": null,
    "stroller_friendly": true,
    "changing_table": null,
    "toilets": true,
    "shade": true,
    "water_fountain": true,
    "accessible": true,
    "website_url": "https://www.tel-aviv.gov.il/Visitors/Beaches/Pages/Beaches.aspx",
    "source_name": "Tel Aviv-Yafo Municipality",
    "source_url": "https://www.tel-aviv.gov.il/Visitors/Beaches/Pages/Beaches.aspx",
    "verification_status": "verified",
    "last_verified_at": "2026-08-05",
    "external_id": null,
    "provider": "apple_maps",
    "provider_place_id": "IBE7F1F5DE0A97602",
    "slug": "tel-baruch-beach",
    "full_description": null,
    "cover_image_url": null,
    "gallery_image_urls": null,
    "high_chairs": null,
    "place_origin": "curated",
    "partner_tags": null
  },
  {
    "name": "Metzitzim Beach",
    "category": "beach",
    "latitude": 32.0937172,
    "longitude": 34.7704972,
    "formatted_address": "Havakuk Hanavi Street 1, Tel Aviv-Yafo, Israel",
    "neighborhood": "Old North",
    "short_description": "Municipal lifeguarded beach in Tel Aviv-Yafo. Check seasonal lifeguard hours before visiting.",
    "is_indoor": false,
    "is_outdoor": true,
    "is_free": true,
    "price_note": null,
    "min_age_months": 0,
    "max_age_months": null,
    "stroller_friendly": true,
    "changing_table": null,
    "toilets": true,
    "shade": true,
    "water_fountain": true,
    "accessible": true,
    "website_url": "https://www.tel-aviv.gov.il/Visitors/Beaches/Pages/Beaches.aspx",
    "source_name": "Tel Aviv-Yafo Municipality",
    "source_url": "https://www.tel-aviv.gov.il/Visitors/Beaches/Pages/Beaches.aspx",
    "verification_status": "verified",
    "last_verified_at": "2026-08-05",
    "external_id": null,
    "provider": "apple_maps",
    "provider_place_id": "IEA72CA691C1DF7B",
    "slug": "metzitzim-beach",
    "full_description": null,
    "cover_image_url": null,
    "gallery_image_urls": null,
    "high_chairs": null,
    "place_origin": "curated",
    "partner_tags": null
  },
  {
    "name": "Hilton Beach",
    "category": "beach",
    "latitude": 32.0903756,
    "longitude": 34.7694099,
    "formatted_address": "Tayelet Shlomo Lahat 0, Tel Aviv-Yafo, Israel",
    "neighborhood": "Old North",
    "short_description": "Municipal lifeguarded beach in Tel Aviv-Yafo. Check seasonal lifeguard hours before visiting.",
    "is_indoor": false,
    "is_outdoor": true,
    "is_free": true,
    "price_note": null,
    "min_age_months": 0,
    "max_age_months": null,
    "stroller_friendly": true,
    "changing_table": null,
    "toilets": true,
    "shade": true,
    "water_fountain": true,
    "accessible": true,
    "website_url": "https://www.tel-aviv.gov.il/Visitors/Beaches/Pages/Beaches.aspx",
    "source_name": "Tel Aviv-Yafo Municipality",
    "source_url": "https://www.tel-aviv.gov.il/Visitors/Beaches/Pages/Beaches.aspx",
    "verification_status": "verified",
    "last_verified_at": "2026-08-05",
    "external_id": null,
    "provider": "apple_maps",
    "provider_place_id": "IAF87569EF707FED8",
    "slug": "hilton-beach",
    "full_description": null,
    "cover_image_url": null,
    "gallery_image_urls": null,
    "high_chairs": null,
    "place_origin": "curated",
    "partner_tags": null
  },
  {
    "name": "Gordon Beach",
    "category": "beach",
    "latitude": 32.0835702,
    "longitude": 34.767973,
    "formatted_address": "Hayarkon Street 123, Tel Aviv-Yafo, Israel",
    "neighborhood": "City Center",
    "short_description": "Municipal lifeguarded beach in Tel Aviv-Yafo. Check seasonal lifeguard hours before visiting.",
    "is_indoor": false,
    "is_outdoor": true,
    "is_free": true,
    "price_note": null,
    "min_age_months": 0,
    "max_age_months": null,
    "stroller_friendly": true,
    "changing_table": null,
    "toilets": true,
    "shade": true,
    "water_fountain": true,
    "accessible": true,
    "website_url": "https://www.tel-aviv.gov.il/Visitors/Beaches/Pages/Beaches.aspx",
    "source_name": "Tel Aviv-Yafo Municipality",
    "source_url": "https://www.tel-aviv.gov.il/Visitors/Beaches/Pages/Beaches.aspx",
    "verification_status": "verified",
    "last_verified_at": "2026-08-05",
    "external_id": null,
    "provider": "apple_maps",
    "provider_place_id": "I448CE05B44BEDE03",
    "slug": "gordon-beach",
    "full_description": null,
    "cover_image_url": null,
    "gallery_image_urls": null,
    "high_chairs": null,
    "place_origin": "curated",
    "partner_tags": null
  },
  {
    "name": "Frishman Beach",
    "category": "beach",
    "latitude": 32.079885,
    "longitude": 34.766559,
    "formatted_address": "Herbert Samuel Pier 105, Tel Aviv-Yafo, Israel",
    "neighborhood": "City Center",
    "short_description": "Municipal lifeguarded beach in Tel Aviv-Yafo. Check seasonal lifeguard hours before visiting.",
    "is_indoor": false,
    "is_outdoor": true,
    "is_free": true,
    "price_note": null,
    "min_age_months": 0,
    "max_age_months": null,
    "stroller_friendly": true,
    "changing_table": null,
    "toilets": true,
    "shade": true,
    "water_fountain": true,
    "accessible": true,
    "website_url": "https://www.tel-aviv.gov.il/Visitors/Beaches/Pages/Beaches.aspx",
    "source_name": "Tel Aviv-Yafo Municipality",
    "source_url": "https://www.tel-aviv.gov.il/Visitors/Beaches/Pages/Beaches.aspx",
    "verification_status": "verified",
    "last_verified_at": "2026-08-05",
    "external_id": null,
    "provider": "apple_maps",
    "provider_place_id": "I2DE3C3BB6622E954",
    "slug": "frishman-beach",
    "full_description": null,
    "cover_image_url": null,
    "gallery_image_urls": null,
    "high_chairs": null,
    "place_origin": "curated",
    "partner_tags": null
  },
  {
    "name": "Jerusalem Beach",
    "category": "beach",
    "latitude": 32.073899,
    "longitude": 34.7643251,
    "formatted_address": "Trumpeldor Beach, Tel Aviv-Yafo, Israel",
    "neighborhood": "City Center",
    "short_description": "Municipal lifeguarded beach in Tel Aviv-Yafo. Check seasonal lifeguard hours before visiting.",
    "is_indoor": false,
    "is_outdoor": true,
    "is_free": true,
    "price_note": null,
    "min_age_months": 0,
    "max_age_months": null,
    "stroller_friendly": true,
    "changing_table": null,
    "toilets": true,
    "shade": true,
    "water_fountain": true,
    "accessible": true,
    "website_url": "https://www.tel-aviv.gov.il/Visitors/Beaches/Pages/Beaches.aspx",
    "source_name": "Tel Aviv-Yafo Municipality",
    "source_url": "https://www.tel-aviv.gov.il/Visitors/Beaches/Pages/Beaches.aspx",
    "verification_status": "verified",
    "last_verified_at": "2026-08-05",
    "external_id": null,
    "provider": "apple_maps",
    "provider_place_id": "IAA5E53E905F022E6",
    "slug": "jerusalem-beach",
    "full_description": null,
    "cover_image_url": null,
    "gallery_image_urls": null,
    "high_chairs": null,
    "place_origin": "curated",
    "partner_tags": null
  },
  {
    "name": "Geula Beach",
    "category": "beach",
    "latitude": 32.0725042,
    "longitude": 34.763746,
    "formatted_address": "Herbert Samuel Pier 51, Tel Aviv-Yafo, Israel",
    "neighborhood": "Kerem HaTeimanim",
    "short_description": "Municipal lifeguarded beach in Tel Aviv-Yafo. Check seasonal lifeguard hours before visiting.",
    "is_indoor": false,
    "is_outdoor": true,
    "is_free": true,
    "price_note": null,
    "min_age_months": 0,
    "max_age_months": null,
    "stroller_friendly": true,
    "changing_table": null,
    "toilets": true,
    "shade": true,
    "water_fountain": true,
    "accessible": true,
    "website_url": "https://www.tel-aviv.gov.il/Visitors/Beaches/Pages/Beaches.aspx",
    "source_name": "Tel Aviv-Yafo Municipality",
    "source_url": "https://www.tel-aviv.gov.il/Visitors/Beaches/Pages/Beaches.aspx",
    "verification_status": "verified",
    "last_verified_at": "2026-08-05",
    "external_id": null,
    "provider": "apple_maps",
    "provider_place_id": "I6105C29D54D97EE4",
    "slug": "geula-beach",
    "full_description": null,
    "cover_image_url": null,
    "gallery_image_urls": null,
    "high_chairs": null,
    "place_origin": "curated",
    "partner_tags": null
  },
  {
    "name": "Charles Clore Beach",
    "category": "beach",
    "latitude": 32.0608142,
    "longitude": 34.7592777,
    "formatted_address": "Charles Clore Beach, Tayelet Shlomo Lahat, Tel Aviv-Yafo, Israel",
    "neighborhood": "Neve Tzedek / Jaffa",
    "short_description": "Municipal lifeguarded beach in Tel Aviv-Yafo. Check seasonal lifeguard hours before visiting.",
    "is_indoor": false,
    "is_outdoor": true,
    "is_free": true,
    "price_note": null,
    "min_age_months": 0,
    "max_age_months": null,
    "stroller_friendly": true,
    "changing_table": null,
    "toilets": true,
    "shade": true,
    "water_fountain": true,
    "accessible": true,
    "website_url": "https://www.tel-aviv.gov.il/Visitors/Beaches/Pages/Beaches.aspx",
    "source_name": "Tel Aviv-Yafo Municipality",
    "source_url": "https://www.tel-aviv.gov.il/Visitors/Beaches/Pages/Beaches.aspx",
    "verification_status": "verified",
    "last_verified_at": "2026-08-05",
    "external_id": null,
    "provider": "apple_maps",
    "provider_place_id": "I6D7C933960171446",
    "slug": "charles-clore-beach",
    "full_description": null,
    "cover_image_url": null,
    "gallery_image_urls": null,
    "high_chairs": null,
    "place_origin": "curated",